{
  "fixture_id": "NODE-IDOR-001",
  "status": "approved",
  "dual_approval": {
    "author": "prompt-engineer-lead",
    "reviewer": "security-architect-reviewer",
    "approved_at": "2026-08-05",
    "commit_revision": "v2.1.0",
    "comments": "Approved IDOR golden finding for node-express-api: the invoice route checks authentication but never verifies the requesting account owns the invoice, allowing cross-tenant financial data disclosure."
  },
  "expected_findings": [
    {
      "finding_id": "NODE-IDOR-001-FINDING-01",
      "severity": "P0",
      "min_evidence_level": "E1",
      "severity_tolerance": 0,
      "allowed_paths": ["routes/invoices.js"]
    }
  ],
  "forbidden_findings": [],
  "expected_clean_areas": []
}
