{
  "fixture_id": "NODE-VERBOSEERR-001",
  "status": "approved",
  "dual_approval": {
    "author": "prompt-engineer-lead",
    "reviewer": "security-architect-reviewer",
    "approved_at": "2026-08-05",
    "commit_revision": "v2.1.0",
    "comments": "Approved verbose-error-disclosure golden finding for node-express-api: the error-handling middleware returns err.stack and err.message to the client unconditionally, with no environment gate."
  },
  "expected_findings": [
    {
      "finding_id": "NODE-VERBOSEERR-001-FINDING-01",
      "severity": "P1",
      "min_evidence_level": "E1",
      "severity_tolerance": 1,
      "allowed_paths": ["errorHandler.js"]
    }
  ],
  "forbidden_findings": [],
  "expected_clean_areas": []
}
