{
  "fixture_id": "ANDROID-WEBVIEWFILEACCESS-001",
  "status": "approved",
  "dual_approval": {
    "author": "prompt-engineer-lead",
    "reviewer": "security-architect-reviewer",
    "approved_at": "2026-08-05",
    "commit_revision": "v2.1.0",
    "comments": "Approved insecure-WebView golden finding for android-master: allowFileAccessFromFileURLs and allowUniversalAccessFromFileURLs are both enabled alongside JavaScript, letting a page reached via this WebView read local app files via file:// URLs."
  },
  "expected_findings": [
    {
      "finding_id": "ANDROID-WEBVIEWFILEACCESS-001-FINDING-01",
      "severity": "P1",
      "min_evidence_level": "E1",
      "severity_tolerance": 1,
      "allowed_paths": ["app/src/main/java/com/example/app/SupportWebViewActivity.kt"]
    }
  ],
  "forbidden_findings": [],
  "expected_clean_areas": []
}
